root@lamponubuntu2004-s-1vcpu-1gb-intel-tor1-01:~# tcpdump -n -i eth0
tcpdump: verbose output suppressed, use -v or -vv for full protocol decode
listening on eth0, link-type EN10MB (Ethernet), capture size 262144 bytes
18:40:35.207217 IP 68.183.194.51.22 > 142.113.139.226.33841: Flags [P.], seq 685838056:685838164, ack 3974880171, win 501, length 108
18:40:35.207260 IP 68.183.194.51.22 > 142.113.139.226.33841: Flags [P.], seq 108:252, ack 1, win 501, length 144
18:40:35.207339 IP 68.183.194.51.22 > 142.113.139.226.33841: Flags [P.], seq 252:288, ack 1, win 501, length 36
18:40:35.207405 IP 68.183.194.51.22 > 142.113.139.226.33841: Flags [P.], seq 288:680, ack 1, win 501, length 392
18:40:35.207470 IP 68.183.194.51.22 > 142.113.139.226.33841: Flags [P.], seq 680:1048, ack 1, win 501, length 368
18:40:35.207538 IP 68.183.194.51.22 > 142.113.139.226.33841: Flags [P.], seq 1048:1232, ack 1, win 501, length 184
18:40:35.207603 IP 68.183.194.51.22 > 142.113.139.226.33841: Flags [P.], seq 1232:1416, ack 1, win 501, length 184
18:40:35.207670 IP 68.183.194.51.22 > 142.113.139.226.33841: Flags [P.], seq 1416:1600, ack 1, win 501, length 184
18:40:35.207731 IP 68.183.194.51.22 > 142.113.139.226.33841: Flags [P.], seq 1600:1784, ack 1, win 501, length 184
18:40:35.210077 IP 142.113.139.226.33841 > 68.183.194.51.22: Flags [.], ack 108, win 514, length 0
18:40:35.210077 IP 142.113.139.226.33841 > 68.183.194.51.22: Flags [.], ack 288, win 513, length 0
18:40:35.210077 IP 142.113.139.226.33841 > 68.183.194.51.22: Flags [.], ack 1048, win 510, length 0
18:40:35.210110 IP 68.183.194.51.22 > 142.113.139.226.33841: Flags [P.], seq 1784:1968, ack 1, win 501, length 184
18:40:35.210200 IP 68.183.194.51.22 > 142.113.139.226.33841: Flags [P.], seq 1968:2136, ack 1, win 501, length 168
18:40:35.210234 IP 68.183.194.51.22 > 142.113.139.226.33841: Flags [P.], seq 2136:2444, ack 1, win 501, length 308
18:40:35.210276 IP 68.183.194.51.22 > 142.113.139.226.33841: Flags [P.], seq 2444:2664, ack 1, win 501, length 220
18:40:35.210341 IP 68.183.194.51.22 > 142.113.139.226.33841: Flags [P.], seq 2664:3180, ack 1, win 501, length 516
18:40:35.210411 IP 68.183.194.51.22 > 142.113.139.226.33841: Flags [P.], seq 3180:3400, ack 1, win 501, length 220
18:40:35.210475 IP 68.183.194.51.22 > 142.113.139.226.33841: Flags [P.], seq 3400:3584, ack 1, win 501, length 184
18:40:35.210540 IP 68.183.194.51.22 > 142.113.139.226.33841: Flags [P.], seq 3584:3768, ack 1, win 501, length 184
18:40:35.210602 IP 68.183.194.51.22 > 142.113.139.226.33841: Flags [P.], seq 3768:3952, ack 1, win 501, length 184
18:40:35.210665 IP 68.183.194.51.22 > 142.113.139.226.33841: Flags [P.], seq 3952:4136, ack 1, win 501, length 184
18:40:35.210727 IP 68.183.194.51.22 > 142.113.139.226.33841: Flags [P.], seq 4136:4320, ack 1, win 501, length 184
18:40:35.210792 IP 68.183.194.51.22 > 142.113.139.226.33841: Flags [P.], seq 4320:4504, ack 1, win 501, length 184
18:40:35.212575 IP 142.113.139.226.33841 > 68.183.194.51.22: Flags [.], ack 1784, win 516, length 0
18:40:35.212575 IP 142.113.139.226.33841 > 68.183.194.51.22: Flags [.], ack 2136, win 514, length 0
18:40:35.212604 IP 68.183.194.51.22 > 142.113.139.226.33841: Flags [P.], seq 4504:4688, ack 1, win 501, length 184
18:40:35.212694 IP 68.183.194.51.22 > 142.113.139.226.33841: Flags [P.], seq 4688:4864, ack 1, win 501, length 176
18:40:35.212751 IP 68.183.194.51.22 > 142.113.139.226.33841: Flags [P.], seq 4864:5188, ack 1, win 501, length 324
18:40:35.212786 IP 68.183.194.51.22 > 142.113.139.226.33841: Flags [P.], seq 5188:5224, ack 1, win 501, length 36
18:40:35.212851 IP 68.183.194.51.22 > 142.113.139.226.33841: Flags [P.], seq 5224:5592, ack 1, win 501, length 368
18:40:35.212917 IP 68.183.194.51.22 > 142.113.139.226.33841: Flags [P.], seq 5592:5960, ack 1, win 501, length 368
18:40:35.212983 IP 68.183.194.51.22 > 142.113.139.226.33841: Flags [P.], seq 5960:6144, ack 1, win 501, length 184
18:40:35.213043 IP 68.183.194.51.22 > 142.113.139.226.33841: Flags [P.], seq 6144:6328, ack 1, win 501, length 184
18:40:35.213111 IP 68.183.194.51.22 > 142.113.139.226.33841: Flags [P.], seq 6328:6512, ack 1, win 501, length 184
18:40:35.213177 IP 68.183.194.51.22 > 142.113.139.226.33841: Flags [P.], seq 6512:6696, ack 1, win 501, length 184
18:40:35.213329 IP 68.183.194.51.22 > 142.113.139.226.33841: Flags [P.], seq 6696:6880, ack 1, win 501, length 184
18:40:35.213412 IP 68.183.194.51.22 > 142.113.139.226.33841: Flags [P.], seq 6880:7064, ack 1, win 501, length 184
18:40:35.213807 IP 142.113.139.226.33841 > 68.183.194.51.22: Flags [.], ack 2664, win 512, length 0
18:40:35.213823 IP 68.183.194.51.22 > 142.113.139.226.33841: Flags [P.], seq 7064:7248, ack 1, win 501, length 184
18:40:35.213902 IP 68.183.194.51.22 > 142.113.139.226.33841: Flags [P.], seq 7248:7572, ack 1, win 501, length 324
18:40:35.213982 IP 68.183.194.51.22 > 142.113.139.226.33841: Flags [P.], seq 7572:7792, ack 1, win 501, length 220
18:40:35.214061 IP 68.183.194.51.22 > 142.113.139.226.33841: Flags [P.], seq 7792:7976, ack 1, win 501, length 184
18:40:35.215064 IP 142.113.139.226.33841 > 68.183.194.51.22: Flags [.], ack 3400, win 516, length 0
18:40:35.215064 IP 142.113.139.226.33841 > 68.183.194.51.22: Flags [.], ack 4504, win 511, length 0
18:40:35.215064 IP 142.113.139.226.33841 > 68.183.194.51.22: Flags [.], ack 4864, win 516, length 0
18:40:35.215090 IP 68.183.194.51.22 > 142.113.139.226.33841: Flags [P.], seq 7976:8160, ack 1, win 501, length 184
18:40:35.215176 IP 68.183.194.51.22 > 142.113.139.226.33841: Flags [P.], seq 8160:8336, ack 1, win 501, length 176
18:40:35.215226 IP 68.183.194.51.22 > 142.113.139.226.33841: Flags [P.], seq 8336:8652, ack 1, win 501, length 316
18:40:35.215297 IP 68.183.194.51.22 > 142.113.139.226.33841: Flags [P.], seq 8652:9020, ack 1, win 501, length 368
18:40:35.215362 IP 68.183.194.51.22 > 142.113.139.226.33841: Flags [P.], seq 9020:9424, ack 1, win 501, length 404
18:40:35.215449 IP 68.183.194.51.22 > 142.113.139.226.33841: Flags [P.], seq 9424:9608, ack 1, win 501, length 184
18:40:35.215527 IP 68.183.194.51.22 > 142.113.139.226.33841: Flags [P.], seq 9608:9792, ack 1, win 501, length 184
18:40:35.215608 IP 68.183.194.51.22 > 142.113.139.226.33841: Flags [P.], seq 9792:9976, ack 1, win 501, length 184
18:40:35.215684 IP 68.183.194.51.22 > 142.113.139.226.33841: Flags [P.], seq 9976:10160, ack 1, win 501, length 184
18:40:35.215712 IP 68.183.194.51.22 > 142.113.139.226.33841: Flags [P.], seq 10160:10352, ack 1, win 501, length 192
18:40:35.215757 IP 68.183.194.51.22 > 142.113.139.226.33841: Flags [P.], seq 10352:10544, ack 1, win 501, length 192
18:40:35.215886 IP 68.183.194.51.22 > 142.113.139.226.33841: Flags [P.], seq 10544:10736, ack 1, win 501, length 192
18:40:35.215959 IP 68.183.194.51.22 > 142.113.139.226.33841: Flags [P.], seq 10736:10928, ack 1, win 501, length 192
18:40:35.216033 IP 68.183.194.51.22 > 142.113.139.226.33841: Flags [P.], seq 10928:11120, ack 1, win 501, length 192
18:40:35.216107 IP 68.183.194.51.22 > 142.113.139.226.33841: Flags [P.], seq 11120:11312, ack 1, win 501, length 192
18:40:35.216194 IP 68.183.194.51.22 > 142.113.139.226.33841: Flags [P.], seq 11312:11504, ack 1, win 501, length 192
18:40:35.216269 IP 68.183.194.51.22 > 142.113.139.226.33841: Flags [P.], seq 11504:11696, ack 1, win 501, length 192
18:40:35.216342 IP 68.183.194.51.22 > 142.113.139.226.33841: Flags [P.], seq 11696:11888, ack 1, win 501, length 192
18:40:35.216417 IP 68.183.194.51.22 > 142.113.139.226.33841: Flags [P.], seq 11888:12080, ack 1, win 501, length 192
18:40:35.216493 IP 68.183.194.51.22 > 142.113.139.226.33841: Flags [P.], seq 12080:12272, ack 1, win 501, length 192
18:40:35.217201 IP 142.113.139.226.33841 > 68.183.194.51.22: Flags [.], ack 5224, win 514, length 0
18:40:35.217201 IP 142.113.139.226.33841 > 68.183.194.51.22: Flags [.], ack 5960, win 511, length 0
18:40:35.217201 IP 142.113.139.226.33841 > 68.183.194.51.22: Flags [.], ack 6328, win 516, length 0
18:40:35.217201 IP 142.113.139.226.33841 > 68.183.194.51.22: Flags [.], ack 7064, win 513, length 0
18:40:35.217228 IP 68.183.194.51.22 > 142.113.139.226.33841: Flags [P.], seq 12272:12464, ack 1, win 501, length 192
18:40:35.217326 IP 68.183.194.51.22 > 142.113.139.226.33841: Flags [P.], seq 12464:12604, ack 1, win 501, length 140
18:40:35.217362 IP 68.183.194.51.22 > 142.113.139.226.33841: Flags [P.], seq 12604:12780, ack 1, win 501, length 176
18:40:35.217405 IP 68.183.194.51.22 > 142.113.139.226.33841: Flags [P.], seq 12780:12956, ack 1, win 501, length 176
18:40:35.217481 IP 68.183.194.51.22 > 142.113.139.226.33841: Flags [P.], seq 12956:13168, ack 1, win 501, length 212
18:40:35.217542 IP 68.183.194.51.22 > 142.113.139.226.33841: Flags [P.], seq 13168:13516, ack 1, win 501, length 348
18:40:35.217606 IP 68.183.194.51.22 > 142.113.139.226.33841: Flags [P.], seq 13516:13708, ack 1, win 501, length 192
18:40:35.217668 IP 68.183.194.51.22 > 142.113.139.226.33841: Flags [P.], seq 13708:13936, ack 1, win 501, length 228
18:40:35.217734 IP 68.183.194.51.22 > 142.113.139.226.33841: Flags [P.], seq 13936:14320, ack 1, win 501, length 384
18:40:35.217810 IP 68.183.194.51.22 > 142.113.139.226.33841: Flags [P.], seq 14320:14668, ack 1, win 501, length 348
18:40:35.217862 IP 68.183.194.51.22 > 142.113.139.226.33841: Flags [P.], seq 14668:14860, ack 1, win 501, length 192
18:40:35.217925 IP 68.183.194.51.22 > 142.113.139.226.33841: Flags [P.], seq 14860:15088, ack 1, win 501, length 228
18:40:35.217990 IP 68.183.194.51.22 > 142.113.139.226.33841: Flags [P.], seq 15088:15472, ack 1, win 501, length 384
18:40:35.218052 IP 68.183.194.51.22 > 142.113.139.226.33841: Flags [P.], seq 15472:15664, ack 1, win 501, length 192
18:40:35.218115 IP 68.183.194.51.22 > 142.113.139.226.33841: Flags [P.], seq 15664:15856, ack 1, win 501, length 192
18:40:35.218179 IP 68.183.194.51.22 > 142.113.139.226.33841: Flags [P.], seq 15856:16048, ack 1, win 501, length 192
18:40:35.218247 IP 68.183.194.51.22 > 142.113.139.226.33841: Flags [P.], seq 16048:16240, ack 1, win 501, length 192
18:40:35.218309 IP 68.183.194.51.22 > 142.113.139.226.33841: Flags [P.], seq 16240:16432, ack 1, win 501, length 192
18:40:35.218372 IP 68.183.194.51.22 > 142.113.139.226.33841: Flags [P.], seq 16432:16624, ack 1, win 501, length 192
18:40:35.218437 IP 68.183.194.51.22 > 142.113.139.226.33841: Flags [P.], seq 16624:16816, ack 1, win 501, length 192
18:40:35.218510 IP 142.113.139.226.33841 > 68.183.194.51.22: Flags [.], ack 7572, win 511, length 0
18:40:35.218510 IP 142.113.139.226.33841 > 68.183.194.51.22: Flags [.], ack 7976, win 516, length 0
18:40:35.218510 IP 142.113.139.226.33841 > 68.183.194.51.22: Flags [.], ack 8336, win 514, length 0
18:40:35.218524 IP 68.183.194.51.22 > 142.113.139.226.33841: Flags [P.], seq 16816:17008, ack 1, win 501, length 192
18:40:35.218570 IP 68.183.194.51.22 > 142.113.139.226.33841: Flags [P.], seq 17008:17148, ack 1, win 501, length 140
18:40:35.218632 IP 68.183.194.51.22 > 142.113.139.226.33841: Flags [P.], seq 17148:17360, ack 1, win 501, length 212
18:40:35.218700 IP 68.183.194.51.22 > 142.113.139.226.33841: Flags [P.], seq 17360:17692, ack 1, win 501, length 332
18:40:35.218759 IP 68.183.194.51.22 > 142.113.139.226.33841: Flags [P.], seq 17692:17920, ack 1, win 501, length 228
18:40:35.218825 IP 68.183.194.51.22 > 142.113.139.226.33841: Flags [P.], seq 17920:18268, ack 1, win 501, length 348
18:40:35.218888 IP 68.183.194.51.22 > 142.113.139.226.33841: Flags [P.], seq 18268:18496, ack 1, win 501, length 228
18:40:35.218951 IP 68.183.194.51.22 > 142.113.139.226.33841: Flags [P.], seq 18496:18844, ack 1, win 501, length 348
18:40:35.219016 IP 68.183.194.51.22 > 142.113.139.226.33841: Flags [P.], seq 18844:19072, ack 1, win 501, length 228
18:40:35.219084 IP 68.183.194.51.22 > 142.113.139.226.33841: Flags [P.], seq 19072:19264, ack 1, win 501, length 192
18:40:35.219143 IP 68.183.194.51.22 > 142.113.139.226.33841: Flags [P.], seq 19264:19456, ack 1, win 501, length 192
18:40:35.219207 IP 68.183.194.51.22 > 142.113.139.226.33841: Flags [P.], seq 19456:19648, ack 1, win 501, length 192
18:40:35.219981 IP 142.113.139.226.33841 > 68.183.194.51.22: Flags [.], ack 9020, win 512, length 0
18:40:35.219981 IP 142.113.139.226.33841 > 68.183.194.51.22: Flags [.], ack 10160, win 516, length 0
18:40:35.219981 IP 142.113.139.226.33841 > 68.183.194.51.22: Flags [.], ack 11120, win 512, length 0
18:40:35.220008 IP 68.183.194.51.22 > 142.113.139.226.33841: Flags [P.], seq 19648:19840, ack 1, win 501, length 192
18:40:35.220124 IP 68.183.194.51.22 > 142.113.139.226.33841: Flags [P.], seq 19840:20016, ack 1, win 501, length 176
18:40:35.220212 IP 68.183.194.51.22 > 142.113.139.226.33841: Flags [P.], seq 20016:20332, ack 1, win 501, length 316
18:40:35.220302 IP 68.183.194.51.22 > 142.113.139.226.33841: Flags [P.], seq 20332:20524, ack 1, win 501, length 192
18:40:35.220356 IP 68.183.194.51.22 > 142.113.139.226.33841: Flags [P.], seq 20524:20752, ack 1, win 501, length 228
18:40:35.220429 IP 68.183.194.51.22 > 142.113.139.226.33841: Flags [P.], seq 20752:21100, ack 1, win 501, length 348
18:40:35.220486 IP 68.183.194.51.22 > 142.113.139.226.33841: Flags [P.], seq 21100:21484, ack 1, win 501, length 384
18:40:35.220508 IP 68.183.194.51.22 > 142.113.139.226.33841: Flags [P.], seq 21484:21520, ack 1, win 501, length 36
18:40:35.220579 IP 68.183.194.51.22 > 142.113.139.226.33841: Flags [P.], seq 21520:21904, ack 1, win 501, length 384
18:40:35.220723 IP 68.183.194.51.22 > 142.113.139.226.33841: Flags [P.], seq 21904:22096, ack 1, win 501, length 192
18:40:35.220802 IP 68.183.194.51.22 > 142.113.139.226.33841: Flags [P.], seq 22096:22288, ack 1, win 501, length 192
18:40:35.220875 IP 68.183.194.51.22 > 142.113.139.226.33841: Flags [P.], seq 22288:22480, ack 1, win 501, length 192
18:40:35.220947 IP 68.183.194.51.22 > 142.113.139.226.33841: Flags [P.], seq 22480:22672, ack 1, win 501, length 192
18:40:35.221019 IP 68.183.194.51.22 > 142.113.139.226.33841: Flags [P.], seq 22672:22864, ack 1, win 501, length 192
18:40:35.221091 IP 68.183.194.51.22 > 142.113.139.226.33841: Flags [P.], seq 22864:23056, ack 1, win 501, length 192
18:40:35.221171 IP 68.183.194.51.22 > 142.113.139.226.33841: Flags [P.], seq 23056:23248, ack 1, win 501, length 192
18:40:35.221243 IP 68.183.194.51.22 > 142.113.139.226.33841: Flags [P.], seq 23248:23440, ack 1, win 501, length 192
18:40:35.221315 IP 68.183.194.51.22 > 142.113.139.226.33841: Flags [P.], seq 23440:23632, ack 1, win 501, length 192
18:40:35.221386 IP 68.183.194.51.22 > 142.113.139.226.33841: Flags [P.], seq 23632:23824, ack 1, win 501, length 192
18:40:35.221457 IP 68.183.194.51.22 > 142.113.139.226.33841: Flags [P.], seq 23824:24016, ack 1, win 501, length 192
18:40:35.221528 IP 68.183.194.51.22 > 142.113.139.226.33841: Flags [P.], seq 24016:24208, ack 1, win 501, length 192
18:40:35.221599 IP 68.183.194.51.22 > 142.113.139.226.33841: Flags [P.], seq 24208:24400, ack 1, win 501, length 192
18:40:35.221671 IP 68.183.194.51.22 > 142.113.139.226.33841: Flags [P.], seq 24400:24592, ack 1, win 501, length 192
18:40:35.221744 IP 68.183.194.51.22 > 142.113.139.226.33841: Flags [P.], seq 24592:24784, ack 1, win 501, length 192
18:40:35.222326 IP 142.113.139.226.33841 > 68.183.194.51.22: Flags [.], ack 12464, win 516, length 0
18:40:35.222326 IP 142.113.139.226.33841 > 68.183.194.51.22: Flags [.], ack 12604, win 515, length 0
18:40:35.222326 IP 142.113.139.226.33841 > 68.183.194.51.22: Flags [.], ack 12956, win 514, length 0
18:40:35.222326 IP 142.113.139.226.33841 > 68.183.194.51.22: Flags [.], ack 13516, win 512, length 0
18:40:35.222326 IP 142.113.139.226.33841 > 68.183.194.51.22: Flags [.], ack 13936, win 516, length 0
18:40:35.222344 IP 68.183.194.51.22 > 142.113.139.226.33841: Flags [P.], seq 24784:24976, ack 1, win 501, length 192
18:40:35.222410 IP 68.183.194.51.22 > 142.113.139.226.33841: Flags [P.], seq 24976:25292, ack 1, win 501, length 316
18:40:35.222431 IP 68.183.194.51.22 > 142.113.139.226.33841: Flags [P.], seq 25292:25328, ack 1, win 501, length 36
18:40:35.222501 IP 68.183.194.51.22 > 142.113.139.226.33841: Flags [P.], seq 25328:25820, ack 1, win 501, length 492
18:40:35.222563 IP 68.183.194.51.22 > 142.113.139.226.33841: Flags [P.], seq 25820:26240, ack 1, win 501, length 420
18:40:35.222628 IP 68.183.194.51.22 > 142.113.139.226.33841: Flags [P.], seq 26240:26816, ack 1, win 501, length 576
18:40:35.222695 IP 68.183.194.51.22 > 142.113.139.226.33841: Flags [P.], seq 26816:27008, ack 1, win 501, length 192
18:40:35.222760 IP 68.183.194.51.22 > 142.113.139.226.33841: Flags [P.], seq 27008:27200, ack 1, win 501, length 192
18:40:35.222823 IP 68.183.194.51.22 > 142.113.139.226.33841: Flags [P.], seq 27200:27392, ack 1, win 501, length 192
18:40:35.222889 IP 68.183.194.51.22 > 142.113.139.226.33841: Flags [P.], seq 27392:27584, ack 1, win 501, length 192
18:40:35.222947 IP 68.183.194.51.22 > 142.113.139.226.33841: Flags [P.], seq 27584:27776, ack 1, win 501, length 192
18:40:35.223013 IP 68.183.194.51.22 > 142.113.139.226.33841: Flags [P.], seq 27776:27968, ack 1, win 501, length 192
18:40:35.223078 IP 68.183.194.51.22 > 142.113.139.226.33841: Flags [P.], seq 27968:28160, ack 1, win 501, length 192
18:40:35.223141 IP 68.183.194.51.22 > 142.113.139.226.33841: Flags [P.], seq 28160:28352, ack 1, win 501, length 192
18:40:35.223206 IP 68.183.194.51.22 > 142.113.139.226.33841: Flags [P.], seq 28352:28544, ack 1, win 501, length 192
18:40:35.223269 IP 68.183.194.51.22 > 142.113.139.226.33841: Flags [P.], seq 28544:28736, ack 1, win 501, length 192
18:40:35.223330 IP 68.183.194.51.22 > 142.113.139.226.33841: Flags [P.], seq 28736:28928, ack 1, win 501, length 192
18:40:35.223394 IP 68.183.194.51.22 > 142.113.139.226.33841: Flags [P.], seq 28928:29120, ack 1, win 501, length 192
18:40:35.223456 IP 68.183.194.51.22 > 142.113.139.226.33841: Flags [P.], seq 29120:29312, ack 1, win 501, length 192
18:40:35.223521 IP 68.183.194.51.22 > 142.113.139.226.33841: Flags [P.], seq 29312:29504, ack 1, win 501, length 192
18:40:35.223586 IP 68.183.194.51.22 > 142.113.139.226.33841: Flags [P.], seq 29504:29696, ack 1, win 501, length 192
18:40:35.223649 IP 68.183.194.51.22 > 142.113.139.226.33841: Flags [P.], seq 29696:29888, ack 1, win 501, length 192
18:40:35.223712 IP 68.183.194.51.22 > 142.113.139.226.33841: Flags [P.], seq 29888:30080, ack 1, win 501, length 192
18:40:35.223774 IP 68.183.194.51.22 > 142.113.139.226.33841: Flags [P.], seq 30080:30272, ack 1, win 501, length 192
18:40:35.223839 IP 68.183.194.51.22 > 142.113.139.226.33841: Flags [P.], seq 30272:30428, ack 1, win 501, length 156
18:40:35.223900 IP 68.183.194.51.22 > 142.113.139.226.33841: Flags [P.], seq 30428:30656, ack 1, win 501, length 228
18:40:35.223963 IP 68.183.194.51.22 > 142.113.139.226.33841: Flags [P.], seq 30656:30848, ack 1, win 501, length 192
18:40:35.224027 IP 68.183.194.51.22 > 142.113.139.226.33841: Flags [P.], seq 30848:31040, ack 1, win 501, length 192
18:40:35.225233 IP 142.113.139.226.33841 > 68.183.194.51.22: Flags [.], ack 14668, win 513, length 0
18:40:35.225234 IP 142.113.139.226.33841 > 68.183.194.51.22: Flags [.], ack 15088, win 511, length 0
18:40:35.225234 IP 142.113.139.226.33841 > 68.183.194.51.22: Flags [.], ack 17008, win 516, length 0
18:40:35.225234 IP 142.113.139.226.33841 > 68.183.194.51.22: Flags [.], ack 17148, win 515, length 0
18:40:35.225234 IP 142.113.139.226.33841 > 68.183.194.51.22: Flags [.], ack 17692, win 513, length 0
18:40:35.225234 IP 142.113.139.226.33841 > 68.183.194.51.22: Flags [.], ack 18268, win 511, length 0
18:40:35.225266 IP 68.183.194.51.22 > 142.113.139.226.33841: Flags [P.], seq 31040:31232, ack 1, win 501, length 192
18:40:35.225306 IP 142.113.139.226.33841 > 68.183.194.51.22: Flags [.], ack 18844, win 516, length 0
18:40:35.225306 IP 142.113.139.226.33841 > 68.183.194.51.22: Flags [.], ack 19456, win 513, length 0
18:40:35.225306 IP 142.113.139.226.33841 > 68.183.194.51.22: Flags [.], ack 19840, win 512, length 0
18:40:35.225306 IP 142.113.139.226.33841 > 68.183.194.51.22: Flags [.], ack 20016, win 511, length 0
18:40:35.225306 IP 142.113.139.226.33841 > 68.183.194.51.22: Flags [.], ack 20524, win 516, length 0
18:40:35.225306 IP 142.113.139.226.33841 > 68.183.194.51.22: Flags [.], ack 21100, win 513, length 0
18:40:35.225387 IP 68.183.194.51.22 > 142.113.139.226.33841: Flags [P.], seq 31232:31372, ack 1, win 501, length 140
18:40:35.225401 IP 142.113.139.226.33841 > 68.183.194.51.22: Flags [.], ack 21520, win 512, length 0
18:40:35.225401 IP 142.113.139.226.33841 > 68.183.194.51.22: Flags [.], ack 22480, win 516, length 0
18:40:35.225401 IP 142.113.139.226.33841 > 68.183.194.51.22: Flags [.], ack 23632, win 511, length 0
18:40:35.225401 IP 142.113.139.226.33841 > 68.183.194.51.22: Flags [.], ack 24784, win 516, length 0
18:40:35.225448 IP 68.183.194.51.22 > 142.113.139.226.33841: Flags [P.], seq 31372:31548, ack 1, win 501, length 176
18:40:35.225502 IP 68.183.194.51.22 > 142.113.139.226.33841: Flags [P.], seq 31548:31760, ack 1, win 501, length 212
18:40:35.225531 IP 68.183.194.51.22 > 142.113.139.226.33841: Flags [P.], seq 31760:31900, ack 1, win 501, length 140
18:40:35.225593 IP 68.183.194.51.22 > 142.113.139.226.33841: Flags [P.], seq 31900:32112, ack 1, win 501, length 212
18:40:35.225657 IP 68.183.194.51.22 > 142.113.139.226.33841: Flags [P.], seq 32112:32444, ack 1, win 501, length 332
18:40:35.225724 IP 68.183.194.51.22 > 142.113.139.226.33841: Flags [P.], seq 32444:32796, ack 1, win 501, length 352
18:40:35.225781 IP 68.183.194.51.22 > 142.113.139.226.33841: Flags [P.], seq 32796:33148, ack 1, win 501, length 352
18:40:35.225842 IP 68.183.194.51.22 > 142.113.139.226.33841: Flags [P.], seq 33148:33536, ack 1, win 501, length 388
18:40:35.225906 IP 68.183.194.51.22 > 142.113.139.226.33841: Flags [P.], seq 33536:34080, ack 1, win 501, length 544
18:40:35.226058 IP 68.183.194.51.22 > 142.113.139.226.33841: Flags [P.], seq 34080:35392, ack 1, win 501, length 1312
18:40:35.226120 IP 68.183.194.51.22 > 142.113.139.226.33841: Flags [P.], seq 35392:35932, ack 1, win 501, length 540
18:40:35.226258 IP 68.183.194.51.22 > 142.113.139.226.33841: Flags [P.], seq 35932:36544, ack 1, win 501, length 612
18:40:35.226344 IP 68.183.194.51.22 > 142.113.139.226.33841: Flags [P.], seq 36544:36736, ack 1, win 501, length 192
18:40:35.226359 IP 142.113.139.226.33841 > 68.183.194.51.22: Flags [.], ack 25292, win 514, length 0
18:40:35.226359 IP 142.113.139.226.33841 > 68.183.194.51.22: Flags [.], ack 25820, win 512, length 0
18:40:35.226359 IP 142.113.139.226.33841 > 68.183.194.51.22: Flags [.], ack 26816, win 516, length 0
18:40:35.226360 IP 142.113.139.226.33841 > 68.183.194.51.22: Flags [.], ack 27392, win 513, length 0
18:40:35.226421 IP 68.183.194.51.22 > 142.113.139.226.33841: Flags [P.], seq 36736:37068, ack 1, win 501, length 332
18:40:35.226477 IP 68.183.194.51.22 > 142.113.139.226.33841: Flags [P.], seq 37068:37420, ack 1, win 501, length 352
18:40:35.226528 IP 68.183.194.51.22 > 142.113.139.226.33841: Flags [P.], seq 37420:37788, ack 1, win 501, length 368
18:40:35.226560 IP 68.183.194.51.22 > 142.113.139.226.33841: Flags [P.], seq 37788:37824, ack 1, win 501, length 36
18:40:35.226626 IP 68.183.194.51.22 > 142.113.139.226.33841: Flags [P.], seq 37824:38208, ack 1, win 501, length 384
18:40:35.226687 IP 68.183.194.51.22 > 142.113.139.226.33841: Flags [P.], seq 38208:38592, ack 1, win 501, length 384
18:40:35.226750 IP 68.183.194.51.22 > 142.113.139.226.33841: Flags [P.], seq 38592:38784, ack 1, win 501, length 192
18:40:35.226812 IP 68.183.194.51.22 > 142.113.139.226.33841: Flags [P.], seq 38784:38976, ack 1, win 501, length 192
18:40:35.226875 IP 68.183.194.51.22 > 142.113.139.226.33841: Flags [P.], seq 38976:39168, ack 1, win 501, length 192
18:40:35.226936 IP 68.183.194.51.22 > 142.113.139.226.33841: Flags [P.], seq 39168:39360, ack 1, win 501, length 192
18:40:35.227077 IP 68.183.194.51.22 > 142.113.139.226.33841: Flags [P.], seq 39360:39552, ack 1, win 501, length 192
18:40:35.227137 IP 68.183.194.51.22 > 142.113.139.226.33841: Flags [P.], seq 39552:39744, ack 1, win 501, length 192
18:40:35.227201 IP 68.183.194.51.22 > 142.113.139.226.33841: Flags [P.], seq 39744:39936, ack 1, win 501, length 192
18:40:35.227269 IP 68.183.194.51.22 > 142.113.139.226.33841: Flags [P.], seq 39936:40128, ack 1, win 501, length 192
18:40:35.227337 IP 68.183.194.51.22 > 142.113.139.226.33841: Flags [P.], seq 40128:40320, ack 1, win 501, length 192
18:40:35.227474 IP 68.183.194.51.22 > 142.113.139.226.33841: Flags [P.], seq 40320:40512, ack 1, win 501, length 192
18:40:35.227552 IP 68.183.194.51.22 > 142.113.139.226.33841: Flags [P.], seq 40512:40704, ack 1, win 501, length 192
18:40:35.227628 IP 68.183.194.51.22 > 142.113.139.226.33841: Flags [P.], seq 40704:40896, ack 1, win 501, length 192
18:40:35.227701 IP 68.183.194.51.22 > 142.113.139.226.33841: Flags [P.], seq 40896:41088, ack 1, win 501, length 192
18:40:35.227775 IP 68.183.194.51.22 > 142.113.139.226.33841: Flags [P.], seq 41088:41280, ack 1, win 501, length 192
18:40:35.227848 IP 68.183.194.51.22 > 142.113.139.226.33841: Flags [P.], seq 41280:41472, ack 1, win 501, length 192
18:40:35.227923 IP 68.183.194.51.22 > 142.113.139.226.33841: Flags [P.], seq 41472:41664, ack 1, win 501, length 192
18:40:35.227997 IP 68.183.194.51.22 > 142.113.139.226.33841: Flags [P.], seq 41664:41856, ack 1, win 501, length 192
18:40:35.228071 IP 68.183.194.51.22 > 142.113.139.226.33841: Flags [P.], seq 41856:42048, ack 1, win 501, length 192
18:40:35.228144 IP 68.183.194.51.22 > 142.113.139.226.33841: Flags [P.], seq 42048:42240, ack 1, win 501, length 192
18:40:35.228231 IP 68.183.194.51.22 > 142.113.139.226.33841: Flags [P.], seq 42240:42432, ack 1, win 501, length 192
18:40:35.228244 IP 142.113.139.226.33841 > 68.183.194.51.22: Flags [.], ack 29696, win 516, length 0
18:40:35.228294 IP 68.183.194.51.22 > 142.113.139.226.33841: Flags [P.], seq 42432:42764, ack 1, win 501, length 332
18:40:35.228367 IP 68.183.194.51.22 > 142.113.139.226.33841: Flags [P.], seq 42764:42992, ack 1, win 501, length 228
18:40:35.228437 IP 68.183.194.51.22 > 142.113.139.226.33841: Flags [P.], seq 42992:43184, ack 1, win 501, length 192
18:40:35.228510 IP 68.183.194.51.22 > 142.113.139.226.33841: Flags [P.], seq 43184:43376, ack 1, win 501, length 192
18:40:35.228584 IP 68.183.194.51.22 > 142.113.139.226.33841: Flags [P.], seq 43376:43568, ack 1, win 501, length 192
18:40:35.228655 IP 68.183.194.51.22 > 142.113.139.226.33841: Flags [P.], seq 43568:43760, ack 1, win 501, length 192
18:40:35.228728 IP 68.183.194.51.22 > 142.113.139.226.33841: Flags [P.], seq 43760:43952, ack 1, win 501, length 192
18:40:35.228798 IP 68.183.194.51.22 > 142.113.139.226.33841: Flags [P.], seq 43952:44144, ack 1, win 501, length 192
18:40:35.228874 IP 68.183.194.51.22 > 142.113.139.226.33841: Flags [P.], seq 44144:44336, ack 1, win 501, length 192
18:40:35.228945 IP 68.183.194.51.22 > 142.113.139.226.33841: Flags [P.], seq 44336:44528, ack 1, win 501, length 192
18:40:35.229021 IP 68.183.194.51.22 > 142.113.139.226.33841: Flags [P.], seq 44528:44720, ack 1, win 501, length 192
18:40:35.229093 IP 68.183.194.51.22 > 142.113.139.226.33841: Flags [P.], seq 44720:44912, ack 1, win 501, length 192
18:40:35.229168 IP 68.183.194.51.22 > 142.113.139.226.33841: Flags [P.], seq 44912:45104, ack 1, win 501, length 192
18:40:35.229239 IP 68.183.194.51.22 > 142.113.139.226.33841: Flags [P.], seq 45104:45296, ack 1, win 501, length 192
18:40:35.229313 IP 68.183.194.51.22 > 142.113.139.226.33841: Flags [P.], seq 45296:45488, ack 1, win 501, length 192
18:40:35.229384 IP 68.183.194.51.22 > 142.113.139.226.33841: Flags [P.], seq 45488:45680, ack 1, win 501, length 192
18:40:35.229461 IP 68.183.194.51.22 > 142.113.139.226.33841: Flags [P.], seq 45680:45872, ack 1, win 501, length 192
18:40:35.229471 IP 142.113.139.226.33841 > 68.183.194.51.22: Flags [.], ack 30272, win 513, length 0
18:40:35.229512 IP 68.183.194.51.22 > 142.113.139.226.33841: Flags [P.], seq 45872:46204, ack 1, win 501, length 332
18:40:35.229534 IP 68.183.194.51.22 > 142.113.139.226.33841: Flags [P.], seq 46204:46240, ack 1, win 501, length 36
18:40:35.229608 IP 68.183.194.51.22 > 142.113.139.226.33841: Flags [P.], seq 46240:46624, ack 1, win 501, length 384
18:40:35.229662 IP 68.183.194.51.22 > 142.113.139.226.33841: Flags [P.], seq 46624:46816, ack 1, win 501, length 192
18:40:35.229725 IP 68.183.194.51.22 > 142.113.139.226.33841: Flags [P.], seq 46816:47008, ack 1, win 501, length 192
18:40:35.229785 IP 68.183.194.51.22 > 142.113.139.226.33841: Flags [P.], seq 47008:47200, ack 1, win 501, length 192
18:40:35.229849 IP 68.183.194.51.22 > 142.113.139.226.33841: Flags [P.], seq 47200:47392, ack 1, win 501, length 192
18:40:35.229909 IP 68.183.194.51.22 > 142.113.139.226.33841: Flags [P.], seq 47392:47584, ack 1, win 501, length 192
18:40:35.229971 IP 68.183.194.51.22 > 142.113.139.226.33841: Flags [P.], seq 47584:47776, ack 1, win 501, length 192
18:40:35.230033 IP 68.183.194.51.22 > 142.113.139.226.33841: Flags [P.], seq 47776:47968, ack 1, win 501, length 192
18:40:35.230095 IP 68.183.194.51.22 > 142.113.139.226.33841: Flags [P.], seq 47968:48160, ack 1, win 501, length 192
18:40:35.230157 IP 68.183.194.51.22 > 142.113.139.226.33841: Flags [P.], seq 48160:48352, ack 1, win 501, length 192
18:40:35.230218 IP 68.183.194.51.22 > 142.113.139.226.33841: Flags [P.], seq 48352:48544, ack 1, win 501, length 192
18:40:35.230280 IP 68.183.194.51.22 > 142.113.139.226.33841: Flags [P.], seq 48544:48736, ack 1, win 501, length 192
18:40:35.230342 IP 68.183.194.51.22 > 142.113.139.226.33841: Flags [P.], seq 48736:48928, ack 1, win 501, length 192
18:40:35.230407 IP 68.183.194.51.22 > 142.113.139.226.33841: Flags [P.], seq 48928:49120, ack 1, win 501, length 192
18:40:35.230467 IP 68.183.194.51.22 > 142.113.139.226.33841: Flags [P.], seq 49120:49312, ack 1, win 501, length 192
18:40:35.230530 IP 68.183.194.51.22 > 142.113.139.226.33841: Flags [P.], seq 49312:49504, ack 1, win 501, length 192
18:40:35.230593 IP 68.183.194.51.22 > 142.113.139.226.33841: Flags [P.], seq 49504:49696, ack 1, win 501, length 192
18:40:35.230747 IP 142.113.139.226.33841 > 68.183.194.51.22: Flags [.], ack 30656, win 512, length 0
18:40:35.230747 IP 142.113.139.226.33841 > 68.183.194.51.22: Flags [.], ack 31232, win 516, length 0
18:40:35.230747 IP 142.113.139.226.33841 > 68.183.194.51.22: Flags [.], ack 31372, win 515, length 0
18:40:35.230767 IP 68.183.194.51.22 > 142.113.139.226.33841: Flags [P.], seq 49696:49888, ack 1, win 501, length 192
18:40:35.230802 IP 142.113.139.226.33841 > 68.183.194.51.22: Flags [.], ack 31760, win 514, length 0
18:40:35.230803 IP 142.113.139.226.33841 > 68.183.194.51.22: Flags [.], ack 32112, win 512, length 0
18:40:35.230803 IP 142.113.139.226.33841 > 68.183.194.51.22: Flags [.], ack 33148, win 516, length 0
18:40:35.230803 IP 142.113.139.226.33841 > 68.183.194.51.22: Flags [.], ack 33536, win 514, length 0
18:40:35.230803 IP 142.113.139.226.33841 > 68.183.194.51.22: Flags [.], ack 35392, win 516, length 0
18:40:35.230851 IP 68.183.194.51.22 > 142.113.139.226.33841: Flags [P.], seq 49888:50028, ack 1, win 501, length 140
18:40:35.230882 IP 68.183.194.51.22 > 142.113.139.226.33841: Flags [P.], seq 50028:50204, ack 1, win 501, length 176
18:40:35.230928 IP 68.183.194.51.22 > 142.113.139.226.33841: Flags [P.], seq 50204:50416, ack 1, win 501, length 212
18:40:35.230987 IP 68.183.194.51.22 > 142.113.139.226.33841: Flags [P.], seq 50416:50784, ack 1, win 501, length 368
18:40:35.231050 IP 68.183.194.51.22 > 142.113.139.226.33841: Flags [P.], seq 50784:51312, ack 1, win 501, length 528
18:40:35.231116 IP 68.183.194.51.22 > 142.113.139.226.33841: Flags [P.], seq 51312:51836, ack 1, win 501, length 524
18:40:35.231262 IP 68.183.194.51.22 > 142.113.139.226.33841: Flags [P.], seq 51836:52220, ack 1, win 501, length 384
18:40:35.231275 IP 142.113.139.226.33841 > 68.183.194.51.22: Flags [.], ack 36544, win 511, length 0
18:40:35.231284 IP 142.113.139.226.33841 > 68.183.194.51.22: Flags [.], ack 37068, win 516, length 0
18:40:35.231284 IP 142.113.139.226.33841 > 68.183.194.51.22: Flags [.], ack 37788, win 513, length 0
18:40:35.231284 IP 142.113.139.226.33841 > 68.183.194.51.22: Flags [.], ack 38592, win 516, length 0
18:40:35.231284 IP 142.113.139.226.33841 > 68.183.194.51.22: Flags [.], ack 39168, win 513, length 0
18:40:35.231284 IP 142.113.139.226.33841 > 68.183.194.51.22: Flags [.], ack 40320, win 516, length 0
18:40:35.231284 IP 142.113.139.226.33841 > 68.183.194.51.22: Flags [P.], seq 1:37, ack 40320, win 516, length 36
18:40:35.231284 IP 142.113.139.226.33841 > 68.183.194.51.22: Flags [.], ack 42048, win 516, length 0
18:40:35.231341 IP 68.183.194.51.22 > 142.113.139.226.33841: Flags [P.], seq 52220:52256, ack 37, win 501, length 36
18:40:35.231357 IP 68.183.194.51.22 > 142.113.139.226.33841: Flags [P.], seq 52256:52412, ack 37, win 501, length 156
18:40:35.231413 IP 68.183.194.51.22 > 142.113.139.226.33841: Flags [P.], seq 52412:52796, ack 37, win 501, length 384
18:40:35.231479 IP 68.183.194.51.22 > 142.113.139.226.33841: Flags [P.], seq 52796:53324, ack 37, win 501, length 528
18:40:35.231540 IP 68.183.194.51.22 > 142.113.139.226.33841: Flags [P.], seq 53324:53712, ack 37, win 501, length 388
18:40:35.231605 IP 68.183.194.51.22 > 142.113.139.226.33841: Flags [P.], seq 53712:54212, ack 37, win 501, length 500
18:40:35.231667 IP 68.183.194.51.22 > 142.113.139.226.33841: Flags [P.], seq 54212:54632, ack 37, win 501, length 420
18:40:35.231728 IP 68.183.194.51.22 > 142.113.139.226.33841: Flags [P.], seq 54632:55016, ack 37, win 501, length 384
18:40:35.231805 IP 68.183.194.51.22 > 142.113.139.226.33841: Flags [P.], seq 55016:55556, ack 37, win 501, length 540
18:40:35.231854 IP 68.183.194.51.22 > 142.113.139.226.33841: Flags [P.], seq 55556:55784, ack 37, win 501, length 228
18:40:35.231918 IP 68.183.194.51.22 > 142.113.139.226.33841: Flags [P.], seq 55784:56168, ack 37, win 501, length 384
18:40:35.231978 IP 68.183.194.51.22 > 142.113.139.226.33841: Flags [P.], seq 56168:56360, ack 37, win 501, length 192
18:40:35.232043 IP 68.183.194.51.22 > 142.113.139.226.33841: Flags [P.], seq 56360:56552, ack 37, win 501, length 192
18:40:35.232108 IP 68.183.194.51.22 > 142.113.139.226.33841: Flags [P.], seq 56552:56744, ack 37, win 501, length 192
18:40:35.232186 IP 68.183.194.51.22 > 142.113.139.226.33841: Flags [P.], seq 56744:56936, ack 37, win 501, length 192
18:40:35.232244 IP 68.183.194.51.22 > 142.113.139.226.33841: Flags [P.], seq 56936:57092, ack 37, win 501, length 156
18:40:35.232307 IP 68.183.194.51.22 > 142.113.139.226.33841: Flags [P.], seq 57092:57284, ack 37, win 501, length 192
18:40:35.232372 IP 68.183.194.51.22 > 142.113.139.226.33841: Flags [P.], seq 57284:57512, ack 37, win 501, length 228
18:40:35.232432 IP 68.183.194.51.22 > 142.113.139.226.33841: Flags [P.], seq 57512:57704, ack 37, win 501, length 192
18:40:35.232495 IP 68.183.194.51.22 > 142.113.139.226.33841: Flags [P.], seq 57704:57896, ack 37, win 501, length 192
18:40:35.232566 IP 68.183.194.51.22 > 142.113.139.226.33841: Flags [P.], seq 57896:58052, ack 37, win 501, length 156
18:40:35.232620 IP 68.183.194.51.22 > 142.113.139.226.33841: Flags [P.], seq 58052:58088, ack 37, win 501, length 36
18:40:35.232677 IP 68.183.194.51.22 > 142.113.139.226.33841: Flags [P.], seq 58088:58280, ack 37, win 501, length 192
18:40:35.232741 IP 68.183.194.51.22 > 142.113.139.226.33841: Flags [P.], seq 58280:58664, ack 37, win 501, length 384
18:40:35.232806 IP 68.183.194.51.22 > 142.113.139.226.33841: Flags [P.], seq 58664:58856, ack 37, win 501, length 192
18:40:35.232870 IP 68.183.194.51.22 > 142.113.139.226.33841: Flags [P.], seq 58856:59048, ack 37, win 501, length 192
18:40:35.232933 IP 68.183.194.51.22 > 142.113.139.226.33841: Flags [P.], seq 59048:59240, ack 37, win 501, length 192
18:40:35.232992 IP 68.183.194.51.22 > 142.113.139.226.33841: Flags [P.], seq 59240:59432, ack 37, win 501, length 192
18:40:35.233053 IP 68.183.194.51.22 > 142.113.139.226.33841: Flags [P.], seq 59432:59624, ack 37, win 501, length 192
18:40:35.233117 IP 68.183.194.51.22 > 142.113.139.226.33841: Flags [P.], seq 59624:59816, ack 37, win 501, length 192
18:40:35.233177 IP 68.183.194.51.22 > 142.113.139.226.33841: Flags [P.], seq 59816:60008, ack 37, win 501, length 192
18:40:35.233238 IP 68.183.194.51.22 > 142.113.139.226.33841: Flags [P.], seq 60008:60200, ack 37, win 501, length 192
18:40:35.233304 IP 68.183.194.51.22 > 142.113.139.226.33841: Flags [P.], seq 60200:60392, ack 37, win 501, length 192
18:40:35.233379 IP 142.113.139.226.33841 > 68.183.194.51.22: Flags [.], ack 42432, win 514, length 0
18:40:35.233379 IP 142.113.139.226.33841 > 68.183.194.51.22: Flags [.], ack 42764, win 513, length 0
18:40:35.233379 IP 142.113.139.226.33841 > 68.183.194.51.22: Flags [.], ack 43568, win 516, length 0
18:40:35.233379 IP 142.113.139.226.33841 > 68.183.194.51.22: Flags [.], ack 45872, win 516, length 0
18:40:35.233379 IP 142.113.139.226.33841 > 68.183.194.51.22: Flags [.], ack 46240, win 514, length 0
18:40:35.233398 IP 68.183.194.51.22 > 142.113.139.226.33841: Flags [P.], seq 60392:60584, ack 37, win 501, length 192
18:40:35.233488 IP 68.183.194.51.22 > 142.113.139.226.33841: Flags [P.], seq 60584:60900, ack 37, win 501, length 316
18:40:35.233563 IP 68.183.194.51.22 > 142.113.139.226.33841: Flags [P.], seq 60900:61112, ack 37, win 501, length 212
18:40:35.233615 IP 68.183.194.51.22 > 142.113.139.226.33841: Flags [P.], seq 61112:61428, ack 37, win 501, length 316
18:40:35.233692 IP 68.183.194.51.22 > 142.113.139.226.33841: Flags [P.], seq 61428:61812, ack 37, win 501, length 384
18:40:35.233771 IP 68.183.194.51.22 > 142.113.139.226.33841: Flags [P.], seq 61812:62040, ack 37, win 501, length 228
18:40:35.233826 IP 68.183.194.51.22 > 142.113.139.226.33841: Flags [P.], seq 62040:62388, ack 37, win 501, length 348
18:40:35.233850 IP 68.183.194.51.22 > 142.113.139.226.33841: Flags [P.], seq 62388:62424, ack 37, win 501, length 36
18:40:35.233912 IP 68.183.194.51.22 > 142.113.139.226.33841: Flags [P.], seq 62424:62616, ack 37, win 501, length 192
18:40:35.233978 IP 68.183.194.51.22 > 142.113.139.226.33841: Flags [P.], seq 62616:63000, ack 37, win 501, length 384
18:40:35.234037 IP 68.183.194.51.22 > 142.113.139.226.33841: Flags [P.], seq 63000:63348, ack 37, win 501, length 348
18:40:35.234103 IP 68.183.194.51.22 > 142.113.139.226.33841: Flags [P.], seq 63348:63576, ack 37, win 501, length 228
18:40:35.234169 IP 68.183.194.51.22 > 142.113.139.226.33841: Flags [P.], seq 63576:63768, ack 37, win 501, length 192
18:40:35.234226 IP 68.183.194.51.22 > 142.113.139.226.33841: Flags [P.], seq 63768:63960, ack 37, win 501, length 192
18:40:35.234234 IP 142.113.139.226.33841 > 68.183.194.51.22: Flags [.], ack 47584, win 516, length 0
18:40:35.234291 IP 68.183.194.51.22 > 142.113.139.226.33841: Flags [P.], seq 63960:64152, ack 37, win 501, length 192
18:40:35.234350 IP 68.183.194.51.22 > 142.113.139.226.33841: Flags [P.], seq 64152:64328, ack 37, win 501, length 176
18:40:35.234417 IP 68.183.194.51.22 > 142.113.139.226.33841: Flags [P.], seq 64328:64712, ack 37, win 501, length 384
18:40:35.234478 IP 68.183.194.51.22 > 142.113.139.226.33841: Flags [P.], seq 64712:64904, ack 37, win 501, length 192
18:40:35.234537 IP 68.183.194.51.22 > 142.113.139.226.33841: Flags [P.], seq 64904:65096, ack 37, win 501, length 192
18:40:35.234597 IP 68.183.194.51.22 > 142.113.139.226.33841: Flags [P.], seq 65096:65288, ack 37, win 501, length 192
18:40:35.234662 IP 68.183.194.51.22 > 142.113.139.226.33841: Flags [P.], seq 65288:65480, ack 37, win 501, length 192
18:40:35.234723 IP 68.183.194.51.22 > 142.113.139.226.33841: Flags [P.], seq 65480:65672, ack 37, win 501, length 192
18:40:35.234784 IP 68.183.194.51.22 > 142.113.139.226.33841: Flags [P.], seq 65672:65864, ack 37, win 501, length 192
18:40:35.234848 IP 68.183.194.51.22 > 142.113.139.226.33841: Flags [P.], seq 65864:66056, ack 37, win 501, length 192
18:40:35.234911 IP 68.183.194.51.22 > 142.113.139.226.33841: Flags [P.], seq 66056:66248, ack 37, win 501, length 192
18:40:35.234974 IP 68.183.194.51.22 > 142.113.139.226.33841: Flags [P.], seq 66248:66440, ack 37, win 501, length 192
18:40:35.235034 IP 68.183.194.51.22 > 142.113.139.226.33841: Flags [P.], seq 66440:66632, ack 37, win 501, length 192
18:40:35.235097 IP 68.183.194.51.22 > 142.113.139.226.33841: Flags [P.], seq 66632:66824, ack 37, win 501, length 192
18:40:35.235158 IP 68.183.194.51.22 > 142.113.139.226.33841: Flags [P.], seq 66824:67016, ack 37, win 501, length 192
18:40:35.235222 IP 68.183.194.51.22 > 142.113.139.226.33841: Flags [P.], seq 67016:67208, ack 37, win 501, length 192
18:40:35.235290 IP 68.183.194.51.22 > 142.113.139.226.33841: Flags [P.], seq 67208:67400, ack 37, win 501, length 192
18:40:35.235350 IP 68.183.194.51.22 > 142.113.139.226.33841: Flags [P.], seq 67400:67556, ack 37, win 501, length 156
18:40:35.235416 IP 68.183.194.51.22 > 142.113.139.226.33841: Flags [P.], seq 67556:67784, ack 37, win 501, length 228
18:40:35.235473 IP 68.183.194.51.22 > 142.113.139.226.33841: Flags [P.], seq 67784:67940, ack 37, win 501, length 156


18:40:35.720312 IP 142.113.139.226.33841 > 68.183.194.51.22: Flags [.], ack 1654416, win 516, length 0
18:40:35.720312 IP 142.113.139.226.33841 > 68.183.194.51.22: Flags [.], ack 1655228, win 512, length 0
18:40:35.720312 IP 142.113.139.226.33841 > 68.183.194.51.22: Flags [.], ack 1655556, win 511, length 0
18:40:35.720312 IP 142.113.139.226.33841 > 68.183.194.51.22: Flags [.], ack 1656076, win 509, length 0
18:40:35.720479 IP 142.113.139.226.33841 > 68.183.194.51.22: Flags [.], ack 1657228, win 505, length 0
18:40:35.720479 IP 142.113.139.226.33841 > 68.183.194.51.22: Flags [.], ack 1657392, win 504, length 0
18:40:35.720479 IP 142.113.139.226.33841 > 68.183.194.51.22: Flags [.], ack 1657392, win 516, length 0
18:40:35.720479 IP 142.113.139.226.33841 > 68.183.194.51.22: Flags [.], ack 1658544, win 511, length 0
18:40:35.720509 IP 68.183.194.51.22 > 142.113.139.226.33841: Flags [P.], seq 1668476:1668632, ack 613, win 501, length 156
18:40:35.720617 IP 68.183.194.51.22 > 142.113.139.226.33841: Flags [P.], seq 1668632:1670044, ack 613, win 501, length 1412
18:40:35.720715 IP 68.183.194.51.22 > 142.113.139.226.33841: Flags [P.], seq 1670044:1670208, ack 613, win 501, length 164
18:40:35.720809 IP 68.183.194.51.22 > 142.113.139.226.33841: Flags [P.], seq 1670208:1670372, ack 613, win 501, length 164
18:40:35.720818 IP 142.113.139.226.33841 > 68.183.194.51.22: Flags [.], ack 1659504, win 516, length 0
18:40:35.720854 IP 68.183.194.51.22 > 142.113.139.226.33841: Flags [P.], seq 1670372:1670640, ack 613, win 501, length 268
18:40:35.720898 IP 68.183.194.51.22 > 142.113.139.226.33841: Flags [P.], seq 1670640:1670804, ack 613, win 501, length 164
18:40:35.721250 IP 142.113.139.226.33841 > 68.183.194.51.22: Flags [P.], seq 613:685, ack 1659504, win 516, length 72
18:40:35.721274 IP 68.183.194.51.22 > 142.113.139.226.33841: Flags [P.], seq 1670804:1670968, ack 685, win 501, length 164
^C
9870 packets captured
9874 packets received by filter
4 packets dropped by kernel
root@lamponubuntu2004-s-1vcpu-1gb-intel-tor1-01:~# ^C
root@lamponubuntu2004-s-1vcpu-1gb-intel-tor1-01:~#
clear
